{"buildzr":"0.0.35","elkjs":"0.12.0","fingerprint":"sha256:c430bb9ff823cb859e4583bb603e854629d133edf04055a19e9c90de785008f4","input":{"file":"workspace.py","sha256":"sha256:408a4aca5b15fbc7d27c0ab954a6ad4c126ddb778d884e2e635bc769ecd806ef"},"k":4,"modelHash":"sha256:38854a9350212aa1f05a3a91e7d4dd19a19c8f559f2413fedaf4081dddc0805b","name":"example","status":"ok","textColor":"wcag","workspace":"example","workspaces":["example"],"workspacesFolder":"../../workspace/buildzr/scripts/serve_example"}
